{"behavior_id":"engineering-verification-foundation-03","case_id":"CASE-FOUND-TRACE-003","catalog_test":"T-FOUND-TRACE-003:integration","check_results":[{"argv":["/usr/bin/env","ruby",".planning/tools/test-repository-verification.rb"],"artifact_checksums":[{"media_type":"text/plain","sha256":"192ce823dca75d77061e782b3466eef782571db8393d3d83645c63badff85414","size":98},{"media_type":"text/plain","sha256":"e3b0c44298fc1c149afbf4c8996fb92427ae41e4649b934ca495991b7852b855","size":0}],"case_ids":["CASE-FOUND-TRACE-003"],"check_id":"evidence-kernel-self-test","cwd":".","diagnostics":["repository_verification_self_test=PASS mutations=19 redaction=10 path_boundary=12 root=caller-cwd"],"exit_code":0,"layer":"validator","result_digest":"e889368e789b9ff6097b619d89f471e9443eac7c7f9594ae023f33ad61b6b1ab","status":"PASS"},{"argv":["/usr/bin/env","mvn","-f","core/pom.xml","test"],"artifact_checksums":[{"media_type":"text/plain","sha256":"6e1e310c30b14d7880d7a0c6cd5120b00c546d9660c500b150e3d2a97d19559a","size":5338},{"media_type":"text/plain","sha256":"b6488cdbe54950d71135fdb276ec325eddca9fa64260def98789e23f802a39c1","size":597}],"case_ids":["CASE-FOUND-TRACE-003"],"check_id":"core-unit","cwd":".","diagnostics":["[INFO] Scanning for projects...\n[INFO] \n[INFO] --------------------< com.ycsopen:ycsopen-sms-core >--------------------\n[INFO] Building ycsopen-sms-core 0.1.0-SNAPSHOT\n[INFO]   from pom.xml\n[INFO] --------------------------------[ jar ]---------------------------------\n[INFO] \n[INFO] --- resources:3.3.1:resources (default-resources) @ ycsopen-sms-core ---\n[INFO] Copying 2 resources from src/main/resources to target/classes\n[INFO] Copying 1 resource from src/main/resources to target/classes\n[INFO] \n[INFO] --- compiler:3.13.0:compile (default-compile) @ ycsopen-sms-core ---\n[INFO] Recompiling the module because of changed source code.\n[INFO] Compiling 70 source files with javac [debug parameters release 21] to target/classes\n[INFO] Annotation processing is enabled because one or more processors were found\n  on the class path. A future release of javac may disable annotation processing\n  unless at least one processor is specified by name (-processor), or a search\n  path is specified (--processor-path, --processor-module-path), or annotation\n  processing is enabled explicitly (-proc:only, -proc:full).\n  Use -Xlint:-options to suppress this message.","WARNING: A Java agent has been loaded dynamically (/Users/laosanzheong/.m2/repository/net/bytebuddy/byte-buddy-agent/1.14.19/byte-buddy-agent-1.14.19.jar)\nWARNING: If a serviceability tool is in use, please run with -XX:+EnableDynamicAgentLoading to hide this warning\nWARNING: If a serviceability tool is not in use, please run with -Djdk.instrument.traceUsage for more information\nWARNING: Dynamic loading of agents will be disallowed by default in a future release\nOpenJDK 64-Bit Server VM warning: Sharing is only supported for boot loader classes because bootstrap classpath has been appended"],"exit_code":0,"layer":"unit","result_digest":"5cf7be0faccf6b1aa82a0147839b77c4888641e691df1977213ecd5d20974c2d","status":"PASS"},{"argv":["/usr/bin/env","npm","--prefix","web","ci"],"artifact_checksums":[{"media_type":"text/plain","sha256":"74e2bcca735082a842416b3c3d7d9b4f8fd97479f6ac7b5b2ce1d38477f17074","size":282},{"media_type":"text/plain","sha256":"38f97cf1a85ed496e933c977f435ecb544ecb54e3bce591d3fd65557bfa7f286","size":1250}],"case_ids":["CASE-FOUND-TRACE-003"],"check_id":"web-install","cwd":".","diagnostics":["added 405 packages, and audited 406 packages in 8s\n\n71 packages are looking for funding\n  run `npm fund` for details\n\n7 vulnerabilities (5 moderate, 1 high, 1 critical)\n\nTo address all issues (including breaking changes), run:\n  npm audit fix --force\n\nRun `npm audit` for details.","npm warn deprecated inflight@1.0.6: This module is not supported, and leaks memory. Do not use it. Check out lru-cache if you want a good and tested way to coalesce async requests by a key value, which is much more comprehensive and powerful.\nnpm warn deprecated whatwg-encoding@3.1.1: Use @exodus/bytes instead for a more spec-conformant and faster implementation\nnpm warn deprecated @humanwhocodes/config-array@0.13.0: Use @eslint/config-array instead\nnpm warn deprecated rimraf@3.0.2: Rimraf versions prior to v4 are no longer supported\nnpm warn deprecated glob@7.2.3: Old versions of glob are not supported, and contain widely publicized security vulnerabilities, which have been fixed in the current version. Please update. Support for old versions may be purchased (at exorbitant rates) by contacting i@izs.me\nnpm warn deprecated @humanwhocodes/object-schema@2.0.3: Use @eslint/object-schema instead\nnpm warn deprecated recharts@2.15.4: 1.x and 2.x branches are no longer active. Bump to Recharts v3 to receive latest features and bugfixes. See https://github.com/recharts/recharts/wiki/3.0-migration-guide\nnpm warn deprecated eslint@8.57.1: This version is no longer supported. Please see https://eslint.org/version-support for other options."],"exit_code":0,"layer":"dependency","result_digest":"3d5df1c34e021519fcbf082db89c1d8b9f087765f3d3a8446bf9a32acf613369","status":"PASS"},{"argv":["/usr/bin/env","npm","--prefix","web","run","lint"],"artifact_checksums":[{"media_type":"text/plain","sha256":"90c807dab35cd2bec5b9dc20a374e8931436453989415ee69630094f3eff09b7","size":130},{"media_type":"text/plain","sha256":"e3b0c44298fc1c149afbf4c8996fb92427ae41e4649b934ca495991b7852b855","size":0}],"case_ids":["CASE-FOUND-TRACE-003"],"check_id":"web-lint","cwd":".","diagnostics":["> ycsopen-sms-web@0.1.0 lint\n> eslint src test scripts playwright.config.ts vite.config.ts --ext .ts,.tsx,.mjs --max-warnings 0"],"exit_code":0,"layer":"static","result_digest":"119186c1ff47068393c81cf86f9f6bb3036942cd5474221ce3810217a3b9f907","status":"PASS"},{"argv":["/usr/bin/env","npm","--prefix","web","test"],"artifact_checksums":[{"media_type":"text/plain","sha256":"cf3b2d10cbfd2112080f65aa3cc2cf435ff828395b7d6b971e3c6fb894b064f4","size":340},{"media_type":"text/plain","sha256":"e3b0c44298fc1c149afbf4c8996fb92427ae41e4649b934ca495991b7852b855","size":0}],"case_ids":["CASE-FOUND-TRACE-003"],"check_id":"web-unit","cwd":".","diagnostics":["> ycsopen-sms-web@0.1.0 test\n> vitest run\n\n\n RUN  v2.1.9 /Users/laosanzheong/Documents/codebases/ycsopen-sms/web\n\n ✓ test/unit/format.test.ts (4 tests) 1ms\n\n Test Files  1 passed (1)\n      Tests  4 passed (4)\n   Start at  06:27:40\n   Duration  485ms (transform 24ms, setup 41ms, collect 7ms, tests 1ms, environment 241ms, prepare 35ms)"],"exit_code":0,"layer":"unit","result_digest":"59d5eeafaef1156c038f40708d91d60bfc6e09a42d3ccc4a1746d3abab6baa0d","status":"PASS"},{"argv":["/usr/bin/env","npm","--prefix","web","run","build"],"artifact_checksums":[{"media_type":"text/plain","sha256":"238bd6ad6cc63cba5cc0b4f806400ff77f551b8b16b4d32b69b5ed85ab334585","size":388},{"media_type":"text/plain","sha256":"e3b0c44298fc1c149afbf4c8996fb92427ae41e4649b934ca495991b7852b855","size":0}],"case_ids":["CASE-FOUND-TRACE-003"],"check_id":"web-build","cwd":".","diagnostics":["> ycsopen-sms-web@0.1.0 build\n> tsc -b && vite build\n\nvite v5.4.21 building for production...\ntransforming...\n✓ 165 modules transformed.\nrendering chunks...\ncomputing gzip size...\ndist/index.html                   0.41 kB │ gzip:   0.33 kB\ndist/assets/index-BUjlYqPw.css    0.86 kB │ gzip:   0.45 kB\ndist/assets/index-CX4e5rBx.js   312.37 kB │ gzip: 103.49 kB\n✓ built in 449ms"],"exit_code":0,"layer":"build","result_digest":"a81d522b8557375aebaeb071516e199995c020468de6d7be470b7d7041073b68","status":"PASS"},{"argv":["/usr/bin/env","node","web/scripts/test-browser-scenario-server.mjs"],"artifact_checksums":[{"media_type":"text/plain","sha256":"d4a119c8bee581055164f82d6ba654765fc8e25a15e0f767e6790e50a0c9f281","size":139},{"media_type":"text/plain","sha256":"e3b0c44298fc1c149afbf4c8996fb92427ae41e4649b934ca495991b7852b855","size":0}],"case_ids":["CASE-FOUND-TRACE-003"],"check_id":"login-scenario-server","cwd":".","diagnostics":["browser_scenario_symlink_tests=PASS cases=3\nbrowser_scenario_server_tests=PASS real_http=true local_google_chrome=not-run viewport=not-run"],"exit_code":0,"layer":"integration","result_digest":"98b5d2d0cc104603adcc71faefe2dd397c1a3b08618ba0e760b9ce4e82429e48","status":"PASS"},{"argv":["/usr/bin/env","node","web/scripts/test-browser-scenario-visual-local-chrome.mjs","--run-local-chrome"],"artifact_checksums":[{"media_type":"text/plain","sha256":"680e56b1d5ed04c2d10fe4231b709676bead8def0412d503a6048814fd824715","size":275},{"media_type":"text/plain","sha256":"e3b0c44298fc1c149afbf4c8996fb92427ae41e4649b934ca495991b7852b855","size":0}],"case_ids":["CASE-FOUND-TRACE-003"],"check_id":"login-scenario-visual-local-chrome","cwd":".","diagnostics":["browser_scenario_visual_local_chrome_tests=PASS cases=15 local_google_chrome=151.0.7922.174 viewport=1440x900 scenario_digest=98415469dd74730e29a7bafa82cd8dafe016ea8247a6a0b78463a3437922b67a visual_rule_digest=4e67aaa77fb9649f2d665d036465be02dced712d0f8e98fb84ad3c2d554c4062"],"exit_code":0,"layer":"browser","result_digest":"b4a47508dabe7b68443ac79a7f7420550de5e9dd1284c9373cc2f1d625b9b0cc","status":"PASS"},{"argv":["/usr/bin/env","npm","--prefix","web","run","test:copy:zh-cn"],"artifact_checksums":[{"media_type":"text/plain","sha256":"9f8ae083bd9b32d26d2ea8134e47f4a975fa3f245bd40b103d84dc55e2c61c7a","size":1226},{"media_type":"text/plain","sha256":"d27cdb8825662baa968208a02de57700a8b8d1fef4a1e9f4f477bb2450d881da","size":164}],"case_ids":["CASE-FOUND-TRACE-003"],"check_id":"copy-local-browser","cwd":".","diagnostics":["> ycsopen-sms-web@0.1.0 test:copy:zh-cn\n> playwright test test/phase01/chinese-copy.spec.ts && node scripts/validate-copy-zh-cn.mjs --registry verification/copy.zh-CN.json --export-fixture verification/fixtures/zh-cn-export.csv --source src/pages/LoginPage.tsx && node scripts/test-copy-zh-cn.mjs\n\n\nRunning 1 test using 1 worker\n